{
  "schema_version": "0.1",
  "record_type": "BENCHMARK_TASK",
  "benchmark_task_id": "fixture.instruction.blue",
  "name": "Offline instruction-following fixture",
  "category": "instruction_following",
  "task_type": "prompt",
  "description": "Synthetic local task for validating strict output instructions.",
  "prompt": {
    "instruction": "Follow the output constraint exactly and add no explanation.",
    "input_template": "Return the word BLUE in uppercase."
  },
  "input_definition": {
    "required_text": { "type": "string", "value": "BLUE" },
    "allow_extra_text": { "type": "boolean", "value": false }
  },
  "prompt_identity": {
    "algorithm": "sha256",
    "prompt_id": "prompt_c342c6a433cdbabbbf0e97a9956e08529c607bb06f991275da08c0ee189f5905",
    "prompt_version": "1.0.0"
  },
  "expected_output": {
    "type": "text",
    "reference": "BLUE",
    "criteria": ["exact text is BLUE", "contains no extra text"]
  },
  "evaluation_method": {
    "type": "exact_match",
    "config": { "case_sensitive": true }
  },
  "metrics": ["correctness", "instruction_following", "completion"],
  "parameters": { "temperature": 0, "max_output_tokens": 8 },
  "tags": ["offline", "fixture", "instruction"],
  "source_class": "TEST_FIXTURE",
  "provenance": { "origin": "LOCAL_AUTHORED", "source_ref": null },
  "metadata": { "synthetic": true, "real_model_score": false },
  "created_at": "2099-05-01T00:00:00.000Z",
  "version": "1.0.0"
}
